{
  "schema": "ias.s4_8.recovery_02_evaluator_binding.v1",
  "status": "frozen",
  "binding_id": "s4_8_recovery_amendment_02_37_take_evaluator_binding",
  "amendment_id": "s4_8_recovery_amendment_02",
  "revision_id": "s4_8_recovery_amendment_02_preholdout_37_take_revision",
  "holdout_id": "s4_8_recovery_amendment_02_unseen_holdout",
  "evaluator": {
    "entrypoint": "isaac_audio_sensors.acquisition.s4_8_recovery_02_evaluator:evaluate_payload",
    "tool_version": "ias_s4_8_recovery_02_evaluator/1.0.0",
    "payload_schema": "ias.s4_8.recovery_02.corrective_metrics.v1",
    "result_schema": "ias.s4_8.recovery_02.criteria_evaluation_result.v1",
    "source_commit": "1d97ba8690a08911d91abd2e32aa1c265808c8c3",
    "source_files": [
      {
        "path": "src/isaac_audio_sensors/acquisition/s4_8_recovery_02_evaluator.py",
        "sha256": "c2d3d45773c3ae635873c07b8f0a165faf09ff62aec83364e7c199042fe687de"
      },
      {
        "path": "src/isaac_audio_sensors/core/acceptance_criteria_corrective_02.py",
        "sha256": "e8438e86e926720c516201865e388402acd2a23c9751750dfd6f200132fe5201"
      },
      {
        "path": "src/isaac_audio_sensors/core/acceptance_criteria_corrective_03.py",
        "sha256": "3fb12a09b505fe9517b4918932a92744c271a41d4148ebe627276a1e08b512e4"
      }
    ]
  },
  "protocol": {
    "protocol_sha256": "755d11746529e594edc81d4863648827118993dcb0764e71b87807da920989f6",
    "planned_take_count": 37,
    "leakage_group_count": 15,
    "planned_take_ids_sha256": "191d864f80be1e41ca10094ffe8ba9d6d91dd0d9d844847fb6d0a912d5beee5e",
    "stratum_counts": {
      "A_controlled_boundary_sweep": 24,
      "B_center_nominal_level": 4,
      "C_center_low_level": 4,
      "D_silence": 3,
      "E_impact_audio_video": 2
    },
    "primary_metric": "squadbot_categorical_direction_accuracy",
    "primary_threshold": 0.75,
    "primary_denominator": 28,
    "take_aggregation": {
      "representative_bearing_field": "estimated_bearing_deg_f_project",
      "representative_bearing_derivation": "linear_median_of_valid_exact_window_bearings",
      "mapping_application": "once_per_take_to_representative_bearing",
      "no_valid_bearing_result": "unavailable",
      "failed_or_missing_take_result": "adverse",
      "active_unavailable_result": "incorrect",
      "rear_unavailable_result": "correct_only_when_take_not_failed",
      "silence_unavailable_result": "correct_only_when_take_not_failed"
    },
    "inherited_criterion_count": 29,
    "effective_gating_criterion_count": 17,
    "continuous_bearing_diagnostic_criteria": [
      "bearing_median_absolute_error_stratum_a",
      "bearing_median_absolute_error_stratum_a_stretch",
      "bearing_median_absolute_error_stratum_b",
      "bearing_p95_absolute_error_stratum_a",
      "bearing_p95_absolute_error_stratum_a_stretch",
      "bearing_worst_absolute_error_stratum_a",
      "sim_adjusted_bearing_median_delta_vs_real",
      "sim_adjusted_bearing_median_delta_vs_real_stretch",
      "within_cell_bearing_circular_range_stratum_a"
    ],
    "superseded_sector_criteria": [
      "sector_accuracy_stratum_b",
      "sector_accuracy_stratum_b_stretch"
    ],
    "comparison_expected_counts": {
      "abstention_abd": 31,
      "bearing_doa_error_ab": 28,
      "candidate_bearing_ab": 28,
      "coarse_audio_video_association_e": 2,
      "confidence_bc": 8,
      "sector_accuracy_b": 4,
      "tdoa_a": 144
    },
    "gating_comparison_ids": [
      "abstention_abd",
      "candidate_bearing_ab",
      "coarse_audio_video_association_e",
      "confidence_bc",
      "tdoa_a"
    ]
  },
  "bindings": {
    "design_manifest": {
      "path": "configs/s4_8_recovery_amendment_02_preholdout_manifest.v2.json",
      "sha256": "379740afa39e86874b8e2c4e5b3f92e58b4d7872fecc982961a39f4637ff0aa9"
    },
    "denominators": {
      "path": "configs/s4_8_recovery_amendment_02_denominators.v2.json",
      "sha256": "dfdaca130adf51ced54e6cb08c515270502e44ea5726c1ce7984b6f6583c300e"
    },
    "criteria_register": {
      "path": "outputs/isaac_audio_sensors/S4/S4.7_corrective_03/criteria_register.json",
      "sha256": "64e9fc170e81174f975d5d67b7ce94b765f967b3826e5e7cd61746ab59e25375"
    },
    "partition_manifest": {
      "path": "outputs/isaac_audio_sensors/S4/S4.4/amendments/s4_4_data_expansion_amendment_04/manifests/prospective_holdout_recovery_02_manifest.v2.json",
      "sha256": "26f28d6ba2e91fd6bf60d1de20e3be90caef60143cf3ca0b89e67c260a2d5b31"
    },
    "session_manifest": {
      "path": "outputs/isaac_audio_sensors/S4/S4.4/amendments/s4_4_data_expansion_amendment_04/manifests/sessions/prospective_holdout_recovery_02.v2.json",
      "sha256": "328abccec1e363b77af53762b8ceabdafd186a50945aa16b7671ce72ecf9b32a"
    },
    "precollection_seal": {
      "path": "outputs/isaac_audio_sensors/S4/S4.4/amendments/s4_4_data_expansion_amendment_04/precollection_seal.v2.json",
      "sha256": "e35359509910d79ef4933748255d71faf6191bd3cb17638e8ea68655367bbf0d",
      "payload_sha256": "c7b7caaefef11795f717be81914bcead54fc2f0b0867c4e87289a54c9359e025"
    },
    "holdout_seal": {
      "path": "outputs/isaac_audio_sensors/S4/S4.4/amendments/s4_4_data_expansion_amendment_04/holdout_seal.v2.json",
      "sha256": "3b5dc394a3e8a112750c947845467f167c8c271106390283f56683a364df2660",
      "payload_sha256": "c2a90baca98feaef4e57fa87669856f9d481e2c05169b1eab73b805a715512df"
    },
    "holdout_binding": {
      "path": "configs/s4_8_recovery_amendment_02_holdout_binding.v2.json",
      "sha256": "a2e1c8e77cf92a43d24e336da89911f25dcb4e283d80a25e5c2a2becf455546b"
    }
  },
  "sealed_state": {
    "technically_sealed": true,
    "scientifically_opened": false,
    "scientific_artifact_contents_parsed": false,
    "scientific_outcomes_derived": false,
    "scientific_outputs_returned": false
  },
  "authority": {
    "adds_independent_review": false,
    "creates_grant": false,
    "consumes_grant": false,
    "opens_holdout": false,
    "runs_evaluation": false
  }
}
